,video_id,video_date,video_description,suggested_words,cos_score,headline,headline_type,headline_genre
1249,7293746388591037726,2023-10-25,our house dr house funny comment game g rumps funny youtube four you,,0.42195565,if every brand is funny online is anything funny,Express,
1250,7293324174204914975,2023-10-23,stephen a smith is undefeated nba nba moments nba memes nba funny,girth and tonnage stephen a smith funny moments skip girth and tonnage skip bayless girth and tunnage stephen a smith out of context stephen a smith rizz stephen a smith pause nba moments funny moments nba nba funny,0.37249598,stephen colbert calls out mike johnsons first fail,Culture,
1251,7293963290823150853,2023-10-25,she was not playing games with this question shoe game wedding shoe game wedding reception reception games viral video brel low wedding party brides of tik tok grooms of tik tok reception,shoe game wedding wearing the pants in the relationship meaning what does it mean to wear the pants shoe game who wears the pants wedding couple questions who wears the pants in relationship meaning what does who wears the pants mean questions for couples,0.37514108,dressing for the entire wedding weekend,Style,
1252,7294042989951896878,2023-10-25,the finals might be one of the few new fps games i acrualy try out the finals fps games first person shooter cod compete ti ve gaming,,0.34532866,the upshot of microsofts activision deal big tech can get even bigger,Business,
1253,7291864876887149829,2023-10-19,tag them red thoughts for her red thoughts red thoughts for him pretty pretty girl,,0.30566394,poem fluid cupid,Magazine,
1254,7274965995737992479,2023-09-04,its like a she scully movie tik tok brook yn funny couple videos,,0.37147,aubrey plaza has found her scene partner,Arts&Leisure,
1255,7294198486508113183,2023-10-26,tik tok movie,,0.38099247,scary movie  at  still kills,Culture,
1258,7293936052887211294,2023-10-25,we went all out at karahiadda in westbury ny on long island and had another unforgettable devourworthy experience this pakistani restaurant with some americanflair needs to be on your list devour power food tik tok kara hi add a westbury westbury ny new york long island kara hi pakistani pakistani food nyc food ies nyc food blog food blog tando ori tando or shrimp chicken goat,indian food devourpower tandoori chicken food new york restaurant new york restaurants food nyc restaurants in new york food new york city foodie,0.37923503,restaurant review hakka food makes a rare appearance in chinatown,Dining,
1259,7258483689036827950,2023-07-21,did you like the ending helm hub trending movies law abiding citizen funny,,0.37667137,the  best movies on netflix right now,Culture,
1260,7257649412015525162,2023-07-19,would you do the same movies helm hub law abiding citizen trending,,0.34150976,can i watch barbenheimer despite the hollywood strikes,Express,
1261,7289923870537059614,2023-10-14,follow for part two revenge movie clips classic blow this up movie scene movie tok movie night law abiding citizen,,0.4404341,all your favorite movies are already on tiktok,Styles,
1262,7293713302079737119,2023-10-24,law abiding citizen tik tok,,0.37191272,listen early to this american life getting away with it,Podcasts,
1263,7293298911513480479,2023-10-23,vines vine viral vine energy,if you gave me a chance this place about to blow if you gave me a chance i could take this place about to blow arab meme if you gave me a chance meme anwar jibawi vines if you gave me a chance i would take it no place id rather be king bach vine if you gave me a chance i could take it meme,0.2596607,i can get it for you wholesale review rag trade revival recut for today,Culture,
1264,7290667199038115105,2023-10-16,ksi reacts to family guy part side men side men reacts family guy funny,,0.38799194,dave chappelle and the perils of buttonpushing comedy,Culture,
1265,7293707911736347937,2023-10-24,,,,dave chappelle and the perils of buttonpushing comedy,Culture,
1267,7293273292847287594,2023-10-23,the first one dark humor jokes laugh comedy,dark humour jokes jokes video humor jokes comedy video funny jokes joke funny joke videos funny videos laugh humor humor tiktok,0.361622,if every brand is funny online is anything funny,Express,
1268,7293869927352536351,2023-10-25,friendly reminder to go all out at khokha in piscataway nj this pakistani american fusion joint hits the spot everytime their beef is straight up addicting devour power food tik tok kho kha p is cat away nj p is cat away burger pakistani comfort food para th a pars th a roll new jersey nj nj food food ies food blog,,0.40863082,a deepfried pho sparks scandal at the state fair of texas,Dining,
1269,7284665409544949022,2023-09-30,pov you just ordered the swine fighter sicilian pizza from tony boloneys in new jersey tony is a mad man in the best way devour power food tik tok pepperoni pepperoni pizza extra pepperoni tony boloney s sicilian pizza food ies nyc food ies nj food new jersey nj pizza pizza nj new jersey pizza nyc pizza new york city new york city pizza,swine fighter pizza pizza tony baloneys pizza pepperoni pizza sicilian pizza devourpower pepperoni deep dish pizza swine fighter sicilian pizza food nyc,0.33378026,pizza chicken is a surefire weeknight winner,Dining,
1270,7223827056428092718,2023-04-19,follow for more strats your premier team can run valor ant tips and tricks,,0.29925218,to display  ants no simple ant farm will do,Science,
1271,7276154466221542688,2023-09-07,important kayo flash valor ant valor ant lineups kay o kay o main kay o lineups ascent,,0.29107386,escape from burning man musk vs the adl listener questions,Podcasts,
1273,7293315151229390112,2023-10-23,,,,escape from burning man musk vs the adl listener questions,Podcasts,
1276,7293176417326533930,2023-10-23,opening this friday bryant park between th nd st and th th ave open fri oct to march holiday shop hours monfri ampm and satsun ampm free bryant park holiday ice skating skate rentals sold separately ammidnight daily bryant park bryant park winter village winter village nyc nyc winter nyc christmas christmas in new york christmas in nyc nyc fall nyc fall bucket list things to do in nyc nyc activities nyc rec s das om in new york explore new york city,,0.4386363,what to see in nyc galleries in october,Weekend,
1277,7293607341272861984,2023-10-24,no its not quite segregation gina part of brooklyn b halloween heist,,0.3565722,halloween is tricky for actors on strike,Express,
1278,7293503268544646443,2023-10-24,when you try to hate watch one piece one piece one piece anime one piece manga anime tik tok anime manga,chou chou one piece one piece chou chou one piece backstory reaction one piece chapter hate watching one piece one piece anime anime watching one piece one piece manga series chu one piece,0.23483682,yohji yamamoto prefers the side view,TStyle,
1280,7293599360238046506,2023-10-24,mckinsey company an elite institution full of worldchangers who arent afraid to compare themselves to the catholic church for more on the management consulting firm watch sundays full segment on mckinsey at the link in our bio,mckinsey consulting mckinsey john oliver mckinsey john oliver management consulting consulting mckinsey consulting jon oliver mckinsey late show last week tonight mckinsey corporate gossip podcast,0.29689464,consulting firm that works with nikki haley faces a sexual assault lawsuit,Politics,
1281,7293190571705797934,2023-10-23,our top aces of vct valor ant vc t valor ant ace valor ant pros valor ant clips,,0.27312967,no charges for troopers who killed cop city protester near atlanta,National,
1282,7281786850543439146,2023-09-22,watch the end family guy family guy meme peter griffin stewie griffin family guy funny moments family guy clips family guyed it family guyed it family guy tik tok family guyed it family guy deutsch family guy lois trending viral video family guy video,people who live in glass houses shouldnt throw stones he who lives in a glass house glass houses family guy people who live in glass houses shouldnt throw stones meaning he who lives in a glass house meaning cavalcade of cartoon comedy family guy clips family guy funny moment glass house family guy,0.26865712,top apple executive defends favoring google on iphones,Business,
1284,7293378965815823662,2023-10-24,buldogis gourmet hot dogs taste test would you try it food critic,buldogis keith lee keith lee buldogis keith lee atlanta buldogis las vegas keith lee ratings buldogis gourmet food review keith lee effect keith lee ufc,0.34284744,michael chiarello chef and food network star dies at ,Obits,
1287,7286321038508444974,2023-10-05,for a fcking lobster rocket that bad ramsay video viral usa gordon ramsay kitchen cooking,,0.3801864,gutting american cuisine,BookReview,
1289,7289182376591199518,2023-10-12,story time the korean bbq beef and kimchi grilled cheese sandwich that i used to sell out of my dorm room in college grilled cheese,,0.40304327,a deepfried pho sparks scandal at the state fair of texas,Dining,
1290,7288476167898729774,2023-10-10,with potatoes and some meat i can make a delicious dinner cooking recipe easy recipe quick recipes meat dinner,disney cooking recipes recipe recipe video easy food recipes meat recipes dinner recipes cooking food dinner cooking recipes with potatoes,0.5109535,comforting recipes that arent casseroles,Dining,
1291,7283504426453634334,2023-09-27,a stop at tony boloneys in jersey city is never complete without their boloney rex sub bonein hour braised short rib sharp smoked white whiz and their caveman sauce devour power food tik tok tony boloney s boloney rex short rib new jersey nj nj food meat beef food ies food blog jur r asic park food blog sandwich bbq,,0.3773924,grilling the worlds biggest meat producer,Climate,
1292,7281645055746526494,2023-09-22,mark your calendars sept th is national lobster day and lukes lobster is not messing around get their half pound lobster rolls before its too late devour power food tik tok lobster roll lobster seafood luke s lobster food blog food ies nyc food blog nyc lobster new york city new york city food nation a lobster day,lobster roll lobsters food tiktok foodtok food new york food nyc food new york city sea food new york devourpower new york,0.3427327,clams ruled this town until the crabs moved in,Foreign,
1294,7293635059272125738,2023-10-24,uber eats partner between october and october you can get two of your orleans favorites skillet cornbread churro bites for the price of one only on uber eats i also love their cheesesteak eggrolls chicken tenders with ranch and countryfried chicken bowl uber uber eats,,0.4512475,chicken souvlaki for dinner strawberry granola for breakfast and jalapeño poppers for halftime,Dining,
1295,7291364606621060398,2023-10-18,honey bbq chicken tenders makes tenders macros calories g protein g carbs g fat ingredients oz chicken breast cup all purpose flour garlic salt onion powder cayenne pepper cup egg whites tbsps hot sauce tbsp pickle juice cup corn flakes tbsps bbq sauce low calorie tbsps honey parsley flakes cooking food fitness weight loss,chicken tenders chicken tenders recipes honey garlic chicken honey bbq chicken nikitafair honey bbq tenders air fryer recipes how to make chicken tenders food recipes honey chipotle tenders,0.3585144,yewande komolafes fivestar sheetpan gochujang chicken,Dining,
1296,7272831772629470495,2023-08-29,spider man no way home,spider man no way home andrew garfield spider man no way home audience reaction tobey maguire no way home tobey spiderman spider man tobey maguire reaction tobey maguire spider man andrew garfield saves mj,0.51862115,a fan made a spiderman film the fallout has been unexpected,Culture,
1297,7293185217374850334,2023-10-23,the pepper boy scramble from egg shop nyc in williamsburg brooklyn probably our favorite breakfast joint in the city whos hungry devour power food tik tok eggs hop eggs hop nyc new york city nyc food breakfast scrambled eggs scramble bacon cheese bec bacon egg and cheese nyc nyc brunch nyc food ies nyc food blog cooking,,0.36954483,how  apartments in new york city disappeared,Metro,
1300,7293617102932561198,2023-10-24,almost halloween fy pp fy pppppppp pppppppp pppp ppp viral national days fall october october october th,,0.3396096,facing cancellation halloween dog festival gets a formal parade route,Express,
1301,7293500216983014687,2023-10-24,devourworthy fried chicken joints in nyc thanks for following along on our foodfilled adventures devour power food tik tok fried chicken nyc new york city comfort food nyc food food blog nyc food blog chicken chicken tenders,,0.39795923,new york has issued  new food cart permits  vendors want them,Metro,
1303,7283458297590467886,2023-09-27,women gets instant karma for her actions towards the waiter,,0.36911738,tiny love stories all women are psychic,Styles,
1304,7293514944912362782,2023-10-24,if you had to choose are you going with the chicken parmesan or the chicken francese with spaghetti from marinarapizzanyc either way youre making a devourworthy decision devour power food tik tok marinara pizza chicken p arm chicken parmesan chicken parmigiana chicken france se nyc nyc food nyc italian food new york city cooking nyc food blog nyc food ies cheese mozzarella butter,,0.36298105,our best eggplant parmesan recipe,,
1306,7286278709831601451,2023-10-04,part on my page gordon ramsay ramsay master chef hells kitchen hotel hell kitchen nightmare food,,0.38166875,no discipline recommended for officers who shot a man in his kitchen,Metro,
1307,7291476112549481761,2023-10-18,,,,no discipline recommended for officers who shot a man in his kitchen,Metro,
1308,7276916377875696938,2023-09-09,so glad i checked this show out hookeed suits louis litt power,,0.33177626, shows to watch this fall,Arts&Leisure,
1309,7286112198135434538,2023-10-04,divers astonishing encounter with heroic seals seals baby seal animals wild animals wildlife animal rescue the strange truth,seal seals helping people seals being cute sea lions golden gate bridge seal that saved leopard seals golden gate bridge seal seals saving humans seals being silly seals saving people,0.49088556,a seal of recognition,Insider,
1310,7290947324883291434,2023-10-17,never forget cs cs go moments cs go,,0.2893049,moments in the buy nothing life,Styles,
1311,7292697897341078826,2023-10-22,most beautiful places in china places that dont feel real adventure nature travel explore travel tik tok appreciate the great work of intro tiniventures cyncynti khanjipeerwala dm us please for credits or removal,,0.36920407,can you find the  adventure travel books hidden in this text,Books,
1312,7293603232620776747,2023-10-24,potato balls better than portos obra bakery ca long beach ca obrabakery food blogger food ie long beach porto s emp an adas food tik tok,obra bakery long beach obra bakery portos bakery potato balls recipe portos potato balls portos potato ball empanadas recipe long beach food empanadas,0.33804032,a deepfried pho sparks scandal at the state fair of texas,Dining,
1313,7293123613522218270,2023-10-23,you cant go wrong with anything at chicken in nyc what are you devouring first their hot chicken is devour power food tik tok chicken fried chicken hot chicken nyc fried chicken fried chicken nyc new york city comfort food nyc food blog nyc food ies,,0.37267634,crispy tostadas fluffy cheddar biscuits and rich chicken mafe,Dining,
1314,7292073742937722155,2023-10-20,tik tok movie film,,0.4039171,scary movie  at  still kills,Culture,
1315,7292102564189932842,2023-10-20,the most iconic voice actor trending usa tik tok na ija anime girl tik tok usa k views trending anime voice actor anime voice actor iconic anime voice actor kenjiro tsuda kenjiro u tsuda,,0.3029076,dancers and video game characters merge in the uncanny valley,Arts&Leisure,
1316,7293572241382509866,2023-10-24,part reddit reddit stories,disney my gf was sa reddit update disney my girlfriend was and i want to leave her reddit update disney card game my gf was sa reddit storytelling my girlfriend answers questions in her sleep story olivia dunne reddit home economics teacher reddit story,0.31631234,tiny love stories you have me now,Styles,
1317,7292228477258861866,2023-10-20,orbito is a two player strategy game you must try board games game night couple fun,disney orbito game orbito how to play orbito board game how to play orbito orbito boardgame disney disney card game how to play orbit english disney game,0.44009247,the best horror board games to play at home,,
1318,7282925517156732203,2023-09-25,bone cold,,0.35086402,great fall,Games,
1330,7082444457227914498,2022-04-03,movie danger,,0.33850724,a violent crisis,NYTNow,
1332,7291246779327204638,2023-10-18,part movie tik tok war,,0.3987234,scary movie  at  still kills,Culture,
1333,7293259650617642271,2023-10-23,going all out at unregularbakery in nycs union square what are you starting with when youre here devour power food tik tok un regular bakery union square nyc nyc food nyc bakery nyc donuts doughnut doughnuts donuts bomb ol one bomb ol ones croissant croissants nyc food blog nyc food ies dessert sweets chocolate,,0.44058144,new york has issued  new food cart permits  vendors want them,Metro,
1334,7292617940661243179,2023-10-21,enhypens th member valor ant en hype n valor ant clips,,0.26991183,why do fanmade trailers rule the internet,Styles,
1335,7286190678248361259,2023-10-05,most usefull raze satchels for ascent pt raze valor ant movement valor ant tips tips and tricks val gaming valor ant raze lineups,,0.23346388,bankmanfrieds risky defense strategy faces another big test,Business,
1336,7283865333583088929,2023-09-28,teddy vs jake theres just no competition brooklyn b per al tiago jake and amy,jake and amy amy dork dance brooklyn jake and amy first kiss amy santiago dork dance teddy and amy amy santiago teddy vs jake jake peralta and amy jake and amy brooklyn,0.31889904,a young designer nabs a viral moment with travis kelce and taylor swift,Styles,
1337,7275199042911587626,2023-09-05,reacting to an ingrown nail removal in grown in grown toenail in grown removal in grown nail in grown toenail removal in grown nail removal doctor doctors doctors of tik tok medicine medical medical humor medical videos surgery nurse nurses podiatry podiatrist podi at ric surgeon surgeons foot surgeon healthcare scrub life,doctor reacts nail videos doctor nail appointment nails pushed into finger medical nail spa gel nail removal nail ring in finger hyper realistic toenail nail drill,0.3793279,how do i get rid of toenail fungus,Well,
1339,7288886945609125162,2023-10-11,family guy,,0.30190834,scary movies,Learning,
1340,7293334965230734638,2023-10-23,very quiet method xyz bca viral funny viral xyz bca,,0.3613991,to go viral on tiktok do this,Styles,
1341,7290496997839162654,2023-10-16,scoliosis surgery d animation spinal fusion spinal fusion surgery spinal fusion survivor spinal fusion surgery recovery spinal fusion recovery scoliosis scoliosis awareness scoliosis treatment scoliosis surgery medical d animation d medical animation,,0.3216949,how a lucrative surgery took off online and disfigured patients,Science,
1342,7288411235484192046,2023-10-10,follow me to learn how to find your dream remote job today remote jobs remote work w fh work from home,work at shein ups data entry job work at shein reviewer shein product reviewer work from home legit jobs part time remote jobs shein reviewer job data entry remote jobs remote job wfh,0.298169,heres what we do and dont know about the effects of remote work,Business,
1344,7293332419317353771,2023-10-23,for u baby kitten r izz baby kitten kitten tok kitten r izz r izz god gf bf pickup lines smooth pickup lines r izz ler,disney rizz cat kitten videos cute kitten pickup lines rizz pickuplines kittens of tiktok rizz cat rizz videos cute kitten clips cute kittens videos,0.2648653,a hairless cat and nickelback what could be more romantic,Styles,
1345,7286792299135175967,2023-10-06,if you know you know the office hilarious funny,,0.49962938,if every brand is funny online is anything funny,Express,
1346,7288138910729801003,2023-10-09,shane gillis shane gillis clips joe biden joke stand up comedy,,0.45202848,dean phillipss lastminute longshot quest to force democrats to reconsider biden,Politics,
1347,7291059782687919390,2023-10-17,rappin yertle the turtle written by dr seuss r appin rhyme books dr seuss dr seuss rap,dr seuss book raps dr seuss rap green eggs and ham rap dr seuss rap video dr suess rap reading teacher rap dr seuss green eggs and ham rap song dr seuss book raps reaction rapping to dr seuss book jordan simons,0.33000302,terrance hayess poems and essays sing in harmony,BookReview,
1348,7293237877947796766,2023-10-23,pizza life especially at unregular pizza in nycs union square have you been which slice are you devouring devour power food tik tok pizza nyc pizza pizza nyc new york city un regular pizza food ies nyc food ies nyc food blog burr at a fried pasta pasta comfort food new york city new york city pizza roman pizza,pizza pizza new york pizza nyc unregularpizza nyc food new york pizza videos food new york city burrata burrata pizza fried pasta,0.32910538,an extremely detailed map of new york city neighborhoods,The Upshot,
1349,7293597420120853803,2023-10-24,atlanta breakfast club taste test would you try it food critic,atlanta breakfast club keith lee keith lee atlanta milk and honey atlanta the real milk and honey the real milk and honey atlanta keith lee atlanta food atlanta restaurants keith lee houston tx atlanta breakfast club keith lee,0.2691757,russell sherman poetic interpreter at the piano is dead at ,Obits,
1350,7288887309150276907,2023-10-11,racism s pic s mexican border wall hopper illegal immigrants ice deport silly,,0.49031207,us will build stretch of border wall and begin deportations to venezuela,National,
1351,7293655359938465030,2023-10-24,this house is insane rate it from designed by renowned architect paul mcclean newport beach luxury homes real estate,,0.3456154,from a floating home in portland to a hilly perch in los angeles which house was right,Real Estate,
1353,7292427099711851807,2023-10-21,he tried his best to stay serious keep a serious face serious face funny fpus a quaker pre grain fy pppppppp pppppppp ppp love conquers all blow this up tik tok xy bca viral moments blow this up fy ppp ppp pppppppp lead by example love moment happy moment love me love me not sleeping beauty what would you have done lil m abu laugh hard,disney news bloopers people laughing in serious situations funny news moments news people trying not to laugh news reporters laughing laughing in serious situations try not not to laugh disney card game news anchor laughing,0.3794607,frans hals and the art of laughter,Arts&Leisure,
1354,7292823207441141022,2023-10-22,the young clip of murr got me impractical jokers impractical jokers clips,,0.3581486,jimmy kimmel wants to be included in trumps gag order,Culture,
1355,7282130350426311979,2023-09-23,how many crackers can hold me,how many dollar bills can hold me how many iphones can hold me evan c how many bills can hold me how many slim jims can hold me how many socks can hold me how many twizzlers can hold me evan c actually gets held how many coat hangers can hold me how many dollar bills can hold me,0.30683887,how many americans are marriage material,OpEd,
1356,7291689075872894250,2023-10-19,duet with dailydoseofpimplepopping wait til the end for a satisfying pop dr pimple popper pop a holi c dpp reacts pimple popper addict,huge pimple bursting zit popping ear pimple pimples and cysts back of ear pimple getting sac out of cyst pimple sac removal blind pimple boil pop extractions triangle of deaf pimple,0.24290784,new ai tool diagnoses brain tumors on the operating table,Science,
1357,7293548583477923104,2023-10-24,wasnt expecting that fy geo guess r twitch geo wizard,,0.29247543,can this man make soccer smarter,Sports,
1359,7291737520830745898,2023-10-19,can already see my randoms locking this character losing the v everytime iso valor ant valor ant funny go jo is oval or ant,iso valorant mordekaiser ult domain expansion iso ult iso iso domain expansion valorant domain expansion mordekaiser iso abilities valorant new agent,0.24967025,joan jett loves the new york liberty the feeling is mutual,Culture,
1360,7292496272727035167,2023-10-21,meme funny de alio,,0.29561788,scary movies,Learning,
1362,7292352191120084266,2023-10-21,surprise ks go omg wdf cs go moments happy game cs go funny y fp cn y fp cn funny moments cs go k cro kc go cs,,0.26319432,how the kansas city chiefs can make the playoffs through week ,The Upshot,
1363,7291408300640341294,2023-10-18,he would drop her off at school in the mornings catholic school things all girls schools catholic girl school,,0.37101823,louisiana public school principal who punished student for dancing apologizes,Express,
1364,7285749336531553579,2023-10-03,what kinda puestion is that funny the basement yard podcast,mussolini explained basement yard the basement yard the basement yard dictator basement yard dictator who is mussolini favorite dictator the basement yard mussolini mouslini the basement yard funny moments,0.2931268,trump said to have revealed nuclear submarine secrets to australian businessman,Washington,
1366,7292798536872398126,2023-10-22,cap cut throw it back no why my boys war shake it,,0.32798165,what i told my daughter about war,Editorial,
1367,7291735612175027488,2023-10-19,i in fact did not reply,,0.31238437,antiracism was never the right answer,OpEd,
1368,7292190735527447838,2023-10-20,gg ez valor ant,,0.27171764,as the israelhamas war rages on,Letters,
1371,7292890024180370734,2023-10-22,dinosaur love,disney disney dinosaurs in love disney card game disney game dinosaurs eating people song dinosaurs dinosaur love dinosaur tiktok disneys card,0.45616093,its not enough to love disney they want to live disney,Styles,
