,video_id,video_date,video_description,suggested_words,cos_score,headline,headline_type,headline_genre
0,7283120378971524385,2023-09-26,funniest animals of the day try not to laugh funny cats funny pets cats of tik tok funny dogs funny animals,try not to laugh funny animal videos try not to laugh extremely impossible funny animals funny cat pets funny videos funny dogs and cats funny moments animals cats being funny funny cats of tiktok,0.278022,meet a millionyearold koala you could cuddle like a cat,Express,
1,7299005323719839007,2023-11-08,the end funny funny videos animals dog cat pet via rl,,0.32943323,snl mocks george santos and welcomes a sassy panda,Culture,
2,7283943882671344928,2023-09-28,via umonhar valor ant valor ant gaming valor ant clip valor ant clips valor ant memes cypher xyz bca,,0.29997823,thats valor biden awards medal of honor to vietnamera army pilot,Washington,
3,7299558131930107166,2023-11-09,family guy family guy clips family guy meme family guy funny moments family guy funny moments family guys family guy post family guy memes family guy moments family guy clip autumn drawn tv that s animated trending viral the simpsons the simpsons clips the simpsons fan the simpsons edit the simpsons season the simpsons challenge the simpsons predict the simpsons show the simpsons game adventure time adventure time edit adventure time cosplay adventure time clips adventure time distant lands adventure time finn adventure time fionn a and cake adventure time art adventure time fan art adventure time jake,,0.3519605,is homer simpson a good dad now,Express,
4,7301677384086998315,2023-11-15,tik tok,,0.36416915,popcast deluxe is the pop music machine stuck in place,Culture,
7,7304818171314392366,2023-11-23,环中国边境行然乌湖,,0.48760676,ramboy,,
8,7303547225009835294,2023-11-20,my mom decoration tik tok moms of tik tok mom life mom tok,,0.27476346,a thai mother rejoices at learning her son is alive,Foreign,
9,7303989148333968686,2023-11-21,honeybun defender hot honey bun viral,homeless man kung fu original video honey bun homeless man using domain expansion original homeless guy kung fu edit homeless kung fu homeless man meme homeless microwave honey bun molten honey bun martial arts,0.36753342,phoenix encampment is gone but the citys homeless crisis persists,National,
12,7298970385842818346,2023-11-08,stitch with street_food meat whacker reaction tik tok food tik tok,,0.37923568,turkey potpie guinea fowl and a hybrid turnip for the thanksgiving table,Dining,
14,7299652643285175582,2023-11-09,the end funny funny videos animals dog cat pet via rl,,0.32943323,snl mocks george santos and welcomes a sassy panda,Culture,
15,7291316350784392491,2023-10-18,a nice little electric screw driver for all of your electronic fixing needs f antti k fan t tike max electric screwdriver,disney disney what the hell is even that fanttik electric screwdriver fantik screwdriver screwdriver set fanttik electric screw driver e max electric screwdriver electronics,0.21532515,a pivotal election in poland heres what to know,Foreign,
17,7302497167963327776,2023-11-17,,,,a pivotal election in poland heres what to know,Foreign,
18,7302460117155351841,2023-11-17,jujutsu kai sen j jk attack on titan a ot romance anime anime an it ok sad viral,kimi ni todoke romance anime anime jujutsukaisen jujutsu kaisen anime takaba jjk animes of tiktok sad anime romance anime moments anime phim,0.3211652,tiny love stories its a romcom opening baby,Styles,
19,7303980660744686881,2023-11-21,nahhh funny skull gy at edit gar nacho cc,define this gen z word for define this gen z word paige taylor motorcycle racing edits gen z news reporter,0.31270406,gen alpha is here can you understand their slang,Styles,
20,7304628248908975392,2023-11-23,teacher is back time to help you rank up faster fna tic boaster valor ant e sports valor ant clips gaming pro agent ranked tips breach,chronicle valorant valorant clips valorant valorant game boaster playing valorant valorant tips and tricks agent agent pro valorant highlights cypher valorant,0.30221856,weekly student news quiz cease fire sam altman cte,The Learning Network,
21,7301558701205245226,2023-11-15,repost this viral,,0.3603769,how viral infections cause longterm health problems,Science,
22,7304813290528541983,2023-11-23,free palestine,,0.49555114,being born in gaza,,
23,7301432171980410142,2023-11-14,ayo its timba gaming funny bro viral video,,0.37653482,a rap comedy hits the road,Culture,
24,7304814952504675626,2023-11-23,viral chall an get ik tok just for fun,,0.35580006,how viral infections cause longterm health problems,Science,
25,7292070527827692846,2023-10-20,stocking stufferchristmas gift idea these really are so cool id have already given them to my kids but so close to christmas it feels like a waste not to use something so fun as a stocking stuffer or gift when i know theyll love them you can snag one too if you click the link on the video christmas ideas tik tok made me buy it astronaut galaxy stars night light room decor,disney astronaut projector nebula projector disney disney card game star projector astronaut galaxy projector galaxy projector light tik tok shop projector,0.2789967,nasa unveils first glimpse of scientific treasure collected from asteroid,Science,
26,7301493529375788293,2023-11-14,how unholy,,0.33248523,how to meditate,,
28,7290844858321866016,2023-10-17,fun funny videos just for fun kangaroo australia wildlife wild animals following follower,,0.36532992,watch how animals react to the scariest sound on the savanna,Science,
29,7295554223331085611,2023-10-29,huh,,0.36793563,cut out,Games,
32,7300377460774931742,2023-11-11,po oki e,,0.33366036,my bad,Podcasts,
33,7298834243856223493,2023-11-07,jujutsu kai sen to ji vs dagon brother sister meme,,0.31130937,militant attack on air base is latest episode to unnerve pakistan,Foreign,
34,7301280508464401694,2023-11-14,russian immigration comedy russia russian immigrant ussr russia travel vodka irish comedy sketch comedy foil arm sandhog,,0.41302755,russia declares gay rights movement as extremist,Foreign,
37,7293239549185019178,2023-10-23,,,,russia declares gay rights movement as extremist,Foreign,
38,7301426408675347755,2023-11-14,bonk lethal company,,0.35090232,grave robbers of the wild west,BookReview,
39,7304814750570007854,2023-11-23,hmm,,0.60046226,my bad,Podcasts,
40,7303713338003836202,2023-11-20,so cute cozy,,0.31462604,garment for a tiny tot,Games,
41,7295467677059976491,2023-10-29,not sure what to think about this display frosty the snowman snowball frosty rudolf the red nose reindeer red nose rain deer,,0.30879495,chris snow hockey executive who publicly faced als dies at ,Sports,
42,7289861655142419717,2023-10-14,flop tok lol viral big rat dookie poop fl opera viral abc xyz slay,,0.372263,buzzfeed in advanced talks to sell complex backtracking on digital media bet,Business,
44,7301912147397741854,2023-11-15,im being watched philly,cat distribution system oratrice mecanique danalyse cardinal cat meowing cat noise attracts cats oratrice mecanique danalyse cat sound to attract cats cat videos kittens meowing cute cat meowing funny cat,0.23036447,watch sea fireflies make underwater fireworks as they seek mates,Science,
45,7294441892245277995,2023-10-26,basecamp starts november th so wish her luck fy p war draft prank war draft prank funny women draft women drafting,war draft prank draft into war prank draft prank pranking my friend she got drafted fake military draft prank draft into war prank women getting drafted prank woman being drafted for war prank woman being drafted for war military draft prank,0.3848273,were the fake trump signs a prank or a political dirty trick,Metropolitan,
46,7293000691688148266,2023-10-23,the cutest thing ive ever seen cheetah meerkat south africa,,0.3570402,the hottest new accessory in niger a russian flag,Foreign,
47,7304706529666534698,2023-11-23,yes it does cap cut case oh fy fy p fy pppppppp pppppppp pppp ppp fy p dong gg gg gg g twitch case oh games viral funny streamer case oh clips biggest streamer gaming fall guys playstation messages ps messages messages,caseoh caseoh ps messages caseoh funny moments fi fy fo fum caseoh games messages on ps gaming caseohgames ps playstation video games,0.28865018,goodbye feminist blogs hello gen z content creators,SundayBusiness,
48,7299732463088045342,2023-11-10,theyre scary pain depressed rel a table sad sad real,,0.37615976,this is not the way to help depressed teenagers,OpEd,
49,7302968748787371270,2023-11-18,fy pppppppp pppppppp pppp ppp the basement yard rel a table content math xy bca school viral xy bca dying fy pppppppp pppppppp pppp ppp the basement yard podcast rel a table funny dumb the basement yard tired fy pppppppp pppppppp pppp ppp rel a table content,,0.23061348,popcast deluxe priscilla and the golden bachelor plumb heartbreak,Culture,
50,7304088212153158943,2023-11-21,what should we call this drink wrong answer only our new drink will be available at select tiger sugar locations starting november nd please contact your nearest tiger sugar store to check availability tiger sugar bob a bubble tea bob a tea milk tea bob a milk tea bob a life bob a love food ie bob a time brown sugar coffee bob a lover bob a addict,boba boba milk tea boba tea bubble tea milk tea brown sugar boba tea brown sugar milk tea bobaaddict sweet tea trying boba drink,0.3014885,tea a train and an epic sunrise at a summer retreat of the raj,Travel,
52,7303794497761086751,2023-11-21,honestly inspiring tennis sports in sport at ional victory viral daily memes memes funny jokes,,0.3613686,how one familys pursuit of tennis success ended in heartache,Sports,
53,7303875286091697438,2023-11-21,i knew it it was a trap pov s mario kart videogames nintendo switch she lied tome james bonded it,,0.3008416,a youtube gossip spills a secret of her own,Styles,
54,7302187145748368683,2023-11-16,bro stopped mid dance bffs pod viakaylee,my brother walked behind me kaylee bffs pod the bffs podcast barstoolsports cute couple dances,0.36452362,at paul taylor a drum circle and a fierce sisterhood,Culture,
55,7304463897292066091,2023-11-22,lmaooo thanksgiving on the train nyc is really a stimulation thanksgiving cooking,thanksgiving nyc subway thanksgiving nyc subway thanksgiving subway nyc jessie thanksgiving episode thanksgiving dinner thanksgiving outfit thanksgiving food we made to thanksgiving,0.5629494,thanksgiving review gobble gobble gasp,Weekend,
56,7296906516894944555,2023-11-02,viral real rel a table ice jake r,minecraft music sakura biome minecraft sakura biome minecraft week minecraft phase downturned minecraft music minecraft phase men have no standard sakura biome house in sky best minecraft seeds,0.30553234,icelandic town evacuated as earthquakes portend volcanic eruption,Express,
57,7296138830799834411,2023-10-31,smells exactly like the taste too christmas gift dr pepper gift candle,,0.34714675,this storebought spice blend makes everything taste better,Dining,
58,7303657430427143425,2023-11-20,this is the fight or flight remix work humor teams work from home silly ring tone corporate marketing microsoft teams,,0.2920981,poor yella rednecks review a writers origin story remixes conventions,Weekend,
60,7274763871703895338,2023-09-03,fr not bl aunt,,0.26732486,the magic of the granny flat,Editorial,
68,7304446235333627167,2023-11-22,hey hey what s going on korea vi wtf ff wtf f viral video viral viral videos wtf moments,he man whats going on hey whats going on he man chloe moretz singing whats going on whats going on song i said hey whats going on skeletor hey whats going on korea whats going on asian guy cover song,0.3454401,south korea sentences dissident who fled china on a jet ski,Foreign,
69,7292712533859798314,2023-10-22,movie film,,0.5041913,scary movies,Learning,
70,7294790130919886123,2023-10-29,my dog has it coming to him were just gonna let the raw turkey do its thing though than sk giving turkey labrador,,0.3955204,turkeys president sends swedens nato bid to parliament for ratification,Foreign,
71,7304357351857851694,2023-11-22,tv show tv series film movie brooklyn brooklyn nine nine,,0.53166735,the best movies and tv shows coming to netflix in november,Culture,
74,7291960426818997536,2023-10-20,re post stealthmounts with userepost i just love this video ive got stuck in plenty of escape rooms to feel her pain stealth mounts vaguehub dm for credit or removal request no copyright intended all rights and credits reserved to the respective owner s,,0.2267069,hundreds of shadow puppets were stolen a bystander helped crack the case,Express,
75,7304036865538247982,2023-11-21,one of the best fps controllers on the market game sir controller tik tok shop black friday tik tok shop gaming wavy s,ps controller stick drift xbox controller what is stick drift best ps controller gamesir g se ps controller no stick drift playstation controller best xbox controller ps pro controller,0.25941867,what to expect on black friday,Smarter Living,
77,7300732541739306282,2023-11-12,you always say acting is just professional lying movie tik tok brook yn funny couple videos,,0.3492847,scene partners review is she brilliant demented both,Culture,
80,7304338205837397291,2023-11-22,places that dont feel real in china travel explore adventure nature,wangxian valley laojun mountain china laojun mountain china places that dont feel real places dont feel real expectation vs reality china expectation vs reality harbin city china china travel,0.3785506,a rare opportunity to see chinas leader up close and sort of personal,Washington,
81,7303327290329419050,2023-11-19,blackface is wrong,matt rife navy seals commercial black faces navy seals navy seal commercial black faces seal comedian matt rife matt rife black guy merchant navy matt rife stand up comedy matt rife undoing belt,0.34310487,us navy rescues ship from somali pirate attack,Washington,
82,7300042349302795526,2023-11-10,they never stop case oh case oh games twitch clip,,0.36029702,another google antitrust battle reaches court in epic games case,Business,
83,7303969322337062174,2023-11-21,cancel culture is only meant for a select few and matt rife is one of them he can join his pal amy matt rife matt rife controversy green screen able is m isnt cute matt rife netflix matt rife sucks zen day a cancelled drama matt rife natural selection,,0.340421,tim scott suspends  campaign as his sunny message failed to resonate,Politics,
85,7290255785345469738,2023-10-15,meme meme cut its so true tho viral trending funny relationships relate able,,0.3327533,to go viral on tiktok do this,Styles,
86,7304365967495286058,2023-11-22,is it now shepherd sebastian,donut daddy sebastian cooking food cooking people cooking food cooking videos cooking tiktok cooking steak meat cooking videos steel pan cooking,0.46881378,what to cook after youve cooked everything,Dining,
87,7303308373473250602,2023-11-19,shibuya incident but its a lil sealy jujutsu kai sen j jk anime nana mi anime nyc,utahime nanami utahime cosplay nanami cosplay gojo gojo cosplay gojo has been sealed nanami death gojo sealed nanami jujutsu kaisen,0.29728296,met announces  art commissions including lee bul sculptor of cyborgs,Culture,
88,7304222961148546350,2023-11-22,what a dramatic scene animlas animals of tik tok wild animals wildlife photography,wildlife animals animals of tiktok wild animals lions wildlife wild animals videos wild animals of tiktok lions videos buffalo funny videos animals,0.29698902,animals meant for adoption may have been turned into reptile food,Express,
89,7304340774022352170,2023-11-22,viral slideshow,,0.27252382,introducing dealbook summit,Podcasts,
90,7303738683419626794,2023-11-20,id give you my last crayon truck tok x s s truck relate able,,0.2509845,thousands wait at ukraine border after polish truckers blockade it,Foreign,
91,7304064456630258987,2023-11-21,para ti az viral xy bca fort nite hop on me,,0.25390524,the egyptian rapper wegz wants to take arabic hiphop worldwide,Culture,
92,7303951855074168097,2023-11-21,cant wait to read this comment section the possiballities are endless brooklyn b,,0.3464594,brooklyn heights a historic waterfront community minutes from manhattan,RealEstate,
93,7303231793698999598,2023-11-19,ts finna be good asf viral video core thanksgiving,,0.48140982,an ai pin drops youtubes take on deepfakes a labgrown thanksgiving,Podcasts,
94,7303943361080069409,2023-11-21,such a violation brooklyn b boyle cold open,,0.32907474,why a boston tea party patriot is being honored in brooklyn,Metro,
95,7303557633020022059,2023-11-20,going all out at kings of kobe in nycs midtown west is now our new favorite activity their wagyu burgers wagyu steak wagyu meatballs giant mozzarella sticks and ritzcracker hot chicken are all insanely devourworthy where would you start devour power food tik tok kings of kobe nyc nyc food new york city nyc burger new york city food wa gyu beef wa gyu burger wa gyu steak mozzarella sticks giant mozzarella stick nyc food ie nyc food ies nyc food blog steakhouse nyc steakhouse,devourpower food nyc kings of kobe nyc food new york food places in nyc food new york city burgers wagyu burger burger nyc restaurants nyc,0.3882573,heres why a new york city lobster roll with fries costs ,Metro,
96,7295485230125878574,2023-10-29,if you had to choose are you devouring the sweet chili chicken frankie roll or the butter chicken frankie roll from fluffieshotchicken in hackensack nj either way youre making a great decision devour power food tik tok naan frankie roll frankie rolls indian food indian fusion n fluff ie shot chicken hackensack hackensack nj butter chicken hot chicken naan dough nyc food blog nj food nj food ies nj food blog new jersey wrap burrito butter sauce,,0.33192986,a deepfried pho sparks scandal at the state fair of texas,Dining,
97,7298216172313447685,2023-11-06,let that sink in fy p,,0.3173338,what the polls say about gaza,NYTNow,
99,7303937519320648990,2023-11-21,the way he lowers my hand to decline pets,,0.31207472,he cared about me so i broke up with him,Podcasts,
100,7300592052457180449,2023-11-12,funny videos meme funny viral xu huon g,do the roar im gonna swing from the chandelier lady glitter sparkle scooby doo laugh chandelier do the roar shrek do the roar scene shrek funny video laugh so hard do the roar kid funny tiktok videos,0.31780854,merry me review a loopy sex comedy focused on female pleasure,Culture,
101,7303607169121914144,2023-11-20,story time trending tik tok,,0.36945063,teenagers in the times fall ,Learning,
102,7304006283789716778,2023-11-21,sova drone nightmare valor ant valor ant clips valor ant gaming,,0.2809864,sea creatures from the deep captured in glass rise at mystic seaport,Arts&Leisure,
105,7303916860863499562,2023-11-21,mama mag gli one movie tik tok brook yn funny couple videos,,0.35532576,whats on tv this week blackberry and jayz and gayle king brooklyns own,Culture,
106,7259552391450758446,2023-07-24,lady trys to escape husband and this happens viral trending movie clips rookie clips movie fake story fake situation fake guns,,0.4091661,video of sexual assault goes viral in india renewing attention on ethnic conflict,Foreign,
107,7275331918802079018,2023-09-05,pt bipolar wife,linda charles the rookie part bipolar wife linda charles the rookie part wife jordan connor the rookie pt missing girl movie clips the rookie bipolar wife the rookie bipolar wife escapes the rookie the rookie linda charles the rookie mujer bipolar parte claire ivey the rookie,0.27627695,jessica lange leads starry cast of new paula vogel play on broadway,Culture,
108,7300513395483135274,2023-11-12,family guy,,0.38413393,dog tv,Learning,
111,7302485141195099434,2023-11-17,tv show tv series film movie brooklyn brooklyn nine nine,,0.53166735,the best movies and tv shows coming to netflix in november,Culture,
112,7303650991553957163,2023-11-20,the perfect date night does exist at da toscano nyc in greenwich village we recommend every single dish in this video devour power food tik tok da toscano greenwich village steak rib eye nyc steak nyc food nyc nyc italian new york city new york city food nyc food ies nyc food blog pasta nyc pasta past any c date night nyc date nite,devourpower da toscano nyc food nyc pasta pasta in nyc food new york nyc greenwich village foodtiktok food new york city date night nyc,0.40226996,what to see in nyc galleries in november,Weekend,
114,7300105723243941162,2023-11-11,twitch joy_bhoy pnn is the new nnn everyone should join poke nut poke nut november pokemon twitch twitch streamer,,0.35110945,gavin newsom wants fox news viewers to hear him out,Politics,
115,7304113535678795050,2023-11-21,people want matt rife cancelled for a joke he made on his netflix comedy special,,0.39890552,snl mocks george santos and welcomes a sassy panda,Culture,
116,7301131158811577630,2023-11-13,lil mans the next karate kid via ishamig karate karate kid funny,karate kicks karate martial arts moves martial arts black belt cheng karate kid karate kid edits karate sparring the karate kid nick canto karate kid anthony larusso the karate kid,0.29836485,arnold diaz tv reporter whose beat was to shame is dead at ,Obits,
117,7301099861586218270,2023-11-13,i say what i do like times daily,what i do asian girl what i do what did i do asian lady witches during the salem trials roman empire nicki minaj my roman empire roman empire costume what i do asian girl at walmart my roman empire trend asian with black accent,0.27070236,heidi klum pauly shore and anya taylorjoy party in new york for halloween,Styles,
118,7304043937226919210,2023-11-21,just wrong fr rel a table viral th grade,,0.32931617,stop corporatizing my students,OpEd,
119,7303671055111949599,2023-11-20,what thefuckcutfhhf,,0.35002974,says who,Games,
120,7303236692012551455,2023-11-19,im back kk vibe work possum three doors down its not my time,gail lewis walmart possum getting dragged opossum football field possum texas tech game opossum walmart employee walmart possum videos olive oil cute possum,0.44938537,the possum experiment,Podcasts,
121,7304145681852157214,2023-11-21,stitch with samsreb how do you do it,gen z zoom in video how to do gen z zoom in gen z zoom mariomirante stitch face zoom zoom filter the stitch face zoom trend hand stitching,0.20051858,family photos have never looked so chic,Styles,
122,7303230396819442977,2023-11-19,funny cute memes funny viral xu huon g cute couple,,0.3647815,tiny love stories its a romcom opening baby,Styles,
123,7303417460533972270,2023-11-20,anti social social clubs booth at complexcon,,0.32699928,film club a toast to raising alcohol taxes,Learning,
125,7302845489886629150,2023-11-18,replying to sager,,0.24248606,pink jersey,Learning,
127,7285015729278045445,2023-10-01,layer air fryer nachos layers below makes a lot of nachos bags of doritos you chose the flavor cups salsa verde pound tacos seasoned ground beef cup black beans cups grated mexican blended cheese cup pickled jalapeños cup fresh jalapeños cup diced onions cup sour cream cup pico de gallo cup guacamole,air fryer recipes air fryer nachos nachos nachos recipe air fryer how to make nachos picos de gallo guacamole recipes nachos mukbang josh elkin,0.3847526,chicken souvlaki for dinner strawberry granola for breakfast and jalapeño poppers for halftime,Dining,
130,7282231425850412318,2023-09-23,astigmatism is the actual worst astigmatism,,0.2515073,the disruptive power of weight loss drugs is being felt beyond pharma,Business,
131,7294057547638656299,2023-10-25,its a labor of love venting story time handy built not bought,,0.29884192,how an effortreward imbalance can make work miserable,Well,
132,7296925146735004970,2023-11-02,vlog of a day in my life without my patek compilation of my videos part,medazelli what you speak english shi tragic new patek deaf school fire alarm medazelliautomatic shi got tragic new patek tragic new patek vlog day in my life cat chattering deaf cat,0.30686718,a tragedy a symphony a love story,Styles,
133,7296984997502651678,2023-11-02,love cute trending heartwarming xyz bca viral trending tik tok,disney touch elbows together elbows touched touch your elbows together if u can touch your elbows love the peoples elbow elbow trick bare below the elbows love tiktoks,0.22621241,terry richardson accused of sexual assault in two new lawsuits,Styles,
137,7289276013111004458,2023-10-12,the best of bobby lee pt bobby lee clips andrew santino bobby lee bad friends podcast,bobby lee bobby lee theme song my name is ronnie sunfire bobby lee bobby lee ronnie chang bobby lee funny moment bobby lee andrew santino bad friends podcast bad friends bobby,0.33247274,steven lutvak whose darkly comic show won a tony dies at ,Obits,
139,7299909854817209631,2023-11-10,funny memes gaming fr fr,,0.3008658,a video game that doubles as a world war i history lesson,Culture,
141,7299467949830802734,2023-11-09,tik tok tv show movie,,0.3791404,mean girls adaptation trailer inspires mixed reactions,Express,
144,7303732273415818526,2023-11-20,yet again i was in another mental hopital this year yyaaayyy,,0.3639635,the big metoo moment for doctors is finally here,OpEd,
145,7295879010515586350,2023-10-30,fy meme memes funny videos bathroom bathroom tik tok tik to ker trending,,0.33252287,weekly student news quiz the israelhamas war a viral video sat data,The Learning Network,
147,7293519759243513119,2023-10-24,wednesday addams addams family plane dance confused viral not my video tik tok wednesday addams,,0.35061693,its friday the th try not to be spooked,Express,
149,7279524945082830122,2023-09-16,discuss with a partner about whether or not you agree with that college life participation grading grades class college,american high shorts discussion post talk for a participation grade college life college college tiktok college student life college student life as a college student college classroom,0.47920156,college students school is not your job,OpEd,
