,video_id,video_date,video_description,suggested_words,cos_score,headline,headline_type,headline_genre
406,7302531414120041770,2023-11-17,how to plot the mandelbrot in desmos des mos math mandelbrot graph math hack julia set complex numbers,desmos mandelbrot set desmos ranked mandelbrot mandelbrot explained mandelbrot desmos desmos speed run how to make mandelbrot desmos desmos graphing art mandelbrot set desmos,0.2908209,how an la rams training complex could help transform urban sprawl,Business,
407,7302502785629654315,2023-11-17,yogi my giant caucasian ovcharka part bearpart lionpart dog if if its is its yogi bears mom caucasian ov char ka russian bear dog guard dog giant dog caucasian shepherd dog growl funny dog big dog yogi ankle biter ancient guard dog mom of four boys lap dog giant lap dog yogi bear a boys best friend a mans best friend bear bear dog bigger than me bigger than you think caucasian mountain dog big animals animal planet the dodo,caucasian overchaka caucasian shepherd caucasian ovcharka puppy ovcharka puppy bernese mountain dog kangal dog mastiff dog newfoundland dog wolf dog biggest dog,0.28695372,dog tv,Learning,
408,7298055725186682155,2023-11-05,gotham batman night relationship,batman batman gotham knight batman costume bruce and selina gotham batman in the room the batman batman laugh batman cartoon gotham jerome gotham knights,0.32743853,gotham fc achieves its captains dream of victory,Metro,
411,7298664481389923616,2023-11-07,when others tell you to act normal who arent acting normal credit unknown funny videos funny animals tik tok funny tik tok animal videos animals of tik tok fun y animals act normal,,0.33090603,snl mocks george santos and welcomes a sassy panda,Culture,
412,7302153699177024801,2023-11-16,cr thee burger dude swipe game swipe trend choose one swipe games trending swipe challenge this or that game food ie food this or that food this or that challenge this or that food edition this or that vegan food,,0.3357235,sizzling dishes and stressful meals give video games warmth,Arts&Leisure,
414,7300580965569645857,2023-11-12,part story time viral,,0.47544634,two stories that unfold through letters,BookReview,
415,7302290227492703534,2023-11-16,j jk su kuna shibuya arc jujutsu kai sen j jk theory,,0.283042,scott pilgrim is back now in anime form,Culture,
416,7301843222236564766,2023-11-15,tv show friends season,phalange planes phalange explained dean pelton what is a phalange phalange plane meaning i got off the plane friends phalange rachel gets off the plane friends plane scene ross and rachel,0.3693444,jennifer aniston and other friends actors reminisce after matthew perrys death,Express,
418,7283972190024912158,2023-09-28,replying to bushelandapeck that jaw clench always sunny its always sunny in philadelphia dennis reynolds glenn howe rton the implication i as ip its always sunny,the implication its always sunny in philadelphia always sunny in philadelphia always sunny bloopers the implication blooper because of the implication its always sunny bloopers dennis system dennis reynolds dennis always sunny,0.30127662,something for everyone even cannibals at the philadelphia fringe,Culture,
420,7299185657233116459,2023-11-08,no fluff no flair just great understated cooking at antico nuovo one of the best restaurants in la infatuation la los angeles la restaurants eeee eats,,0.33505797,a cooks tour of the tokyo food scene,Travel,
421,7299115701996997931,2023-11-08,theres a new smash burger joint in nyc and it is our friends at chicken just opened their new concept ko burger in chinatown and theyre serving up some devourworthy smash burgers that wont break the bank which burger are you choosing devour power food tik tok smas burger nyc burger new york city ko burger chinatown burger nyc new york city food new york city burger nyc food ies nyc food blog nyc food ie,devourpower th street burger burger burger nyc food nyc food new york chinatown nyc food new york city food nyc burger restaurants food places in nyc,0.46523666,hamburger america from a burger documentarian opens in the village,Dining,
422,7283664571494042911,2023-09-27,bro coulda just said no and i wouldve been fine with it,,0.36326128,id do it again,Games,
423,7302462380859067681,2023-11-17,unbreakable bond naruto naruto ship pu den naruto uzumaki nine tailed fox nine tail fox nine tails kuru ma sage of six paths viral viral video viral tik tok viral edit anime anime edit anime tik tok anime fy p fy pppppppp pppppppp pppp ppp,baryon mode naruto boruto kurama naruto kurama naruto edit naruto nine tailed fox anime anime edits naruto clips naruto shippuden,0.28004652,david holmes the boy who lived review harry potters stunt wizard,Weekend,
424,7302682298703416607,2023-11-18,tarik watches the most insane raze ult that changes direction valor ant gaming valor ant clips valor ant,,0.27543193,weekly student news quiz cease fire sam altman cte,The Learning Network,
425,7302409071309753630,2023-11-17,movie,,0.37634844,painting,Learning,
427,7290681738118892842,2023-10-16,this took such a turn comedy stand up stand up comedy funny matt rife improv crowd work gay,matt rife and zendaya matt rife matt rife shemar moore matt rife zendaya matt rife edit matt rife and shemar moore stand up comedy standup matt rife stand up comedy comedian matt rife,0.3785216,dave chappelle and the perils of buttonpushing comedy,Culture,
428,7281823296688065838,2023-09-22,sorry for lack of uploads lately grind starts again full guides for sunset and breeze still being worked on but look out for them valor ant pocket kay o kj to do to do,,0.27194974,burning man is always a challenge but burners like me know this time is different,OpEd,
429,7301878941256650015,2023-11-15,the end funny funny videos animals dog cat pet via rl,,0.32943323,snl mocks george santos and welcomes a sassy panda,Culture,
430,7301427613388590368,2023-11-14,,,,snl mocks george santos and welcomes a sassy panda,Culture,
431,7301076877920210219,2023-11-13,duet with mirian santos you can actually sense the relief after draining this we categorize it as acute vs chronic paronychia dr pimple popper nails paro ny chia der mun has,paronychia on finger paronychia on toe abscess drainage paronychia removal paronychia draining paronychia popping in grown toenail paronychia on toenail infected toenail toenail ingrown removal,0.27374262,fingernails review love factually,Weekend,
432,7301510134834924833,2023-11-14,mystery for your page creepy reddit stories paranormal glitch in the matrix glitch,,0.3362819, podcasts about mysterious disappearances,Arts&Leisure,
434,7284314315513924910,2023-09-29,moody days in ticino switzerland,switzerland ticino switzerland switzerland reality zurich switzerland swiss switzerland switzerland aesthetic skiing in switzerland switzerland travelling video swiss switzerland in winter,0.3078627,swiss court acquits belarusian in disappearance of opposition leaders,Foreign,
435,7302267641287150878,2023-11-16,mappa jujutsu kai sen,mappa animators mappa mappa studio jujutsu mappa employee jujutsukaisen mappa reiner mechamaru jujutsu kaisen satosugu jujutsu kaisen toge inumaki jujutsu kaisen,0.22994715,the boy and the heron review hayao miyazaki has a question for you,Culture,
436,7302701359067958574,2023-11-18,valor ant valor ant clips va or ant funny valor ant gaming valor ant memes play game gaming,,0.24571854,weekly student news quiz cease fire sam altman cte,The Learning Network,
438,7300290788146089262,2023-11-11,thank goodness life hacks amazing shout out ot via tarotyongig,,0.30914265,best christmas ever review frenemies rejoice,Weekend,
439,7301460729415191851,2023-11-14,the way he betrays her,cats cuddling cats in love chase and millie cat meowing dontstopmeowing chase the cat cat sounds attract cats cat love cat cuddle meowing,0.24880245,merry me review a loopy sex comedy focused on female pleasure,Culture,
441,7302005447765151019,2023-11-16,its great to have a teacher like that tik tok emilia jones troy kot sur marle em atl in daniel durant,coda audition scene ruby rossi audition coda coda movie ruby rossi audition scene judges reaction ruby rossi ruby rossi audition judges reaction ruby rossi movie ruby rossi audition scene la famille bélier,0.3080954,heidi klum pauly shore and anya taylorjoy party in new york for halloween,Styles,
442,7301683016206667051,2023-11-15,pt mildly infuriating infuriating pictures,,0.33907065,hold that thought heres why being interrupted is so irritating,Well,
443,7297588757644070190,2023-11-04,kei reacts to family guy most offensive jokes side men side plus side men sunday funny laugh reacts family guy meme family guy funny moments family guy clips peter griffin ksi reacts viral video joke,,0.4017323,snatch adams review grossout humor for notsoeasilyshocked liberals,Culture,
444,7301947959774694687,2023-11-16,video funny so cute funny videos animals dog cat meme cute viral xu huon g,,0.31023932,snl mocks george santos and welcomes a sassy panda,Culture,
445,7301772193799687456,2023-11-15,the struggle is real toilet toilet habits toilet time poop made it in time log huge poop clenching clenching cheeks fy fy pppppppp pppppppp pppp ppp fy poop toilet tik tok for u for for your page for your pages for you page official l,,0.21601717,this easy pantry meal puts dreamy pasta and beans front and center,Dining,
446,7302705435792903467,2023-11-18,mmmmmm valorant valor ant gaming,,0.34916276,test your protein knowledge,Well,
449,7282015672538893574,2023-09-23,moist cr tikal penguin z,,0.3073992,zombie trout unsettle montana long a flyfishing mecca,Science,
450,7302588146531798318,2023-11-17,bravest lil birdie,its okay birdie birdie bravest lil birdie hey birdie little birdie water tiktok drinking water water video drink your water glass of water and towel for headache,0.34888396,a buttermilkbrined chicken in advance of the big bird,Dining,
451,7301562167415852331,2023-11-15,he really is that blue eyes white dragon with those heads he has j jk go jo,,0.33125156,he wont stop taking pictures until hes partying on the other side,Arts&Leisure,
452,7300334572183506222,2023-11-11,vlog of a day in my life without my patek compilation of my videos part medazelli medazelli automatic shi tragic shi tragic new pate k shi tragic b outta cop mean ewp a tek it can get tragic he buggin he bugging he must not know that im thug g in new pate k me daze lli meme explore funny tik tok shit tragic new p adic viral me daze lli compilation go viral humor tragic new pate k me daze lli like blow this up trending animals,medazelli he buggin he must not know that im thuggin shi tragic new patek tragic new patek medazelli compilation shi got tragic new patek shittragic newpadic tragic new patek videos thats tragic new patek he buggin must not know them thuggin,0.33614585,a tragedy a symphony a love story,Styles,
453,7298852961537740078,2023-11-07,we went all out with the trufflepacked cheesesteaks at cheesesteaksbytruffleist in bryant parks winter village in nyc and woah where would you start love this spot devour power food tik tok truffle is t truffle cheesesteak cheesesteaks nyc food nyc food ie nyc food ies nyc food blog bryant park bryant park winter village new york city burr at a nyc winter nyc market cheesy fried,,0.4230002,what to see in nyc galleries in november,Weekend,
454,7301716154689604907,2023-11-15,i wanted to invite you and jocelyn movie tik tok brook yn funny couple videos,,0.38194442,heidi klum pauly shore and anya taylorjoy party in new york for halloween,Styles,
456,7291469368200793386,2023-10-18,funny animals cat,,0.27749756,wildlife find human voices scarier than lion roars researchers say,,
457,7301866049387924779,2023-11-15,which is your favorite dance moves dancing dance challenge,,0.42653114,at paul taylor the music calls for a dance the men respond,Culture,
458,7302532204427611424,2023-11-17,colouring a manga page anime anime art manga anime drawing artists of tik tok j jk jujutsu kai sen su kuna su kunar yo men domain expansion su kuna domain expansion,malevolent shrine let him cook original video let him cook coloring my manga coloring manga panels malevolent kitchen meme sukuna manga art manga sukuna ryomen,0.35156947,met announces  art commissions including lee bul sculptor of cyborgs,Culture,
459,7302690156371316014,2023-11-18,valor ant valor ant clips va or ant funny valor ant gaming valor ant memes play game gaming,,0.24571854,weekly student news quiz cease fire sam altman cte,The Learning Network,
460,7299985380185754926,2023-11-10,this signs get straight to the point scary warning warning signs viral share,unsettling signs swipe scary video scary things scary video footage reading signs at stores stop sign video the warning polar bear different types of warning sirens scary sounds,0.28737298,two studies on greenland reveal ominous signs for sea level rise,Climate,
461,7302707945710554410,2023-11-18,part if you want to act like you own the place then you better stay behind to help clean up funny viral acting pov story skit,,0.36394665,behind the story how a writer prepared for a mile trip,TStyle,
462,7277953623286467883,2023-09-12,brooklyn nine nine movie,,0.41603222,five childrens movies to stream now,Culture,
464,7302153549381651742,2023-11-16,costco chicken bake hack cost co food chicken bake hotdog pizza los angeles lunch la food ie eat with me muk bang food tik tok,chicken bake costco costco food chicken bake costco pizza costco food court costco costco mukbang food reviews costco food hacks costco food review,0.3185305,pasta and rice may be healthier as leftovers heres why,Well,
467,7301429123325398315,2023-11-14,the chicken tikka masala naan pizza from mumbaidreamsnyack in nyack ny love this place have you been devour power food tik tok mumbai dreams n yack ny n yack chicken tikka chicken tikka masala naan pizza naan indian food indian fusion nyc food nyc food blog nyc food ie pizza,food reviews chicken tikka masala pizza chicken tikka masala pizza foodtiktok chicken pizza food nyc chicken masala pizza nyc indian food,0.3819364,classics for a reason crispy mustard chicken singapore noodles and ambrosia salad,Dining,
468,7302074187789749547,2023-11-16,among us but valorant edition,,0.27005985,inside our list,,
469,7294325132439325995,2023-10-26,this guy is definitely possessed sketch comedy skit snl key and peel e rel a table possessed exorcism exorcist priest that s a bad idea,thats a bad idea key and peele foreshadowing skit when youre not possessed key and peele key peele key and peele comedy sketch exorcist bad idea key and peele skits possessed pranks,0.4118315,dave chappelle and the perils of buttonpushing comedy,Culture,
470,7302535746211319086,2023-11-17,best sage walls on the planet grim valor ant sage walls grim walls valor ant clips valor ant funny sage sage valor ant,,0.29131374,please dont destroy the treasure of foggy mountain review fools gold,Culture,
473,7301704117448084778,2023-11-15,the surf turf ramen stir fry from street to table in merrick ny on long island yeah you need this devour power food tik tok stir fry ramen ramen stir fry long island long island ny long island food ramen noodles street to table merrick merrick ny nyc food nyc food ies nyc food blog ny food,,0.4459617, excellent asian noodle soups in three boroughs,Dining,
474,7302082043448462634,2023-11-16,ksi reacts to family guy most offensive jokes wait for stewies part side men sunday ksi reacts side men funny moments side men peter griffin family guy clips family guy funny moments family guy family guy meme smile side men reacts side men moments reacts funny laugh,horton hears domestic family guy ksi reacts to family guy family guys family guy funny moments ksi family guy videos family guy clips stewie from family guy sidemen funny moments sidemen,0.32003668,merry me review a loopy sex comedy focused on female pleasure,Culture,
475,7302626249933901087,2023-11-17,for u baby kitten r izz baby kitten kitten tok kitten r izz r izz god gf bf pickup lines smooth pickup lines r izz ler,,0.27508947,how terms of endearment brought a mother and daughter closer,Arts&Leisure,
477,7302447587062205739,2023-11-17,the spaghetti alla vodka fried pasta from unregular pizza in nyc hits every damn time have you devoured one yet devour power fried pasta pasta un regular pizza un regular pasta spaghetti all a vodka all a vodka vodka sauce spaghetti fried spaghetti italian italian food nyc food nyc nyc food ie nyc food blog nyc food ies,fried spaghetti devourpower fried pasta spaghetti pasta nyc food unregularpizza nyc italian food italian pasta foodie,0.37566173,pasta and rice may be healthier as leftovers heres why,Well,
478,7285788355760131374,2023-10-03,goths still exist com dey comedian humor stand up stand up comedy stand up comedian shane gillis ms sp,,0.5256289,dave chappelle and the perils of buttonpushing comedy,Culture,
479,7286895859982191903,2023-10-06,day cases w shiro cs,,0.2939064,word of the day zoonotic,Learning,
480,7285368344700636458,2023-10-02,wild supermodel sighting com dey comedian humor stand up stand up comedy stand up comedian tom segura tom segura comedy,,0.55444413,dave chappelle and the perils of buttonpushing comedy,Culture,
481,7300153988043902238,2023-11-11,full scene of the interview the end is hilarious harvey specter mike ross suits suits netflix,suits suits interview scene mike ross interview harvey specter suits best scenes mike ross suits tv show mike ross best scene harvey and mike suits ending scene,0.29279843,mayhem at openai our interview with sam altman,Podcasts,
483,7302231420473314603,2023-11-16,this comment section is wild diet soup with major side effects q na tumblr rel a table funny text story texts tweets story time meme,peel a pound soup peel a pound soup before and after peel a pound soup result cabbage soup soup soup in a jar soup bowls gummy bears soup dumplings peel a pound soup comment,0.44203016,look up in the sky its a can of soup,Business,
484,7302705415148686638,2023-11-18,oh jeez anime anime fy p we lp we eb viral,,0.41209844,scott pilgrim is back now in anime form,Culture,
486,7302698075305332014,2023-11-18,女主丈夫偷吃自己也去偷吃是你你會怎麼辦,,0.29093415,libraries,Learning,
487,7301078888065617184,2023-11-13,haha cat cat r izz,rizz pick up lines rizz pickup lines pick up lines with rizz cat rizz cat videos cat of tiktok cat rizz videos kittens of tiktok rizz kittens of tiktok,0.28411543,weekly student news quiz birds baseball bankmanfried,The Learning Network,
488,7298520000858590510,2023-11-06,deedee megadoodoo news bloopers news fail dee dee mega doo doo news news anchor,news bloopers sum ting wong the f are you doing news news fails we tried to reach out to the man sum ting wong captain what the f are you doing news blooper funny news moments we need to acknowledge a mistake i made news e norma stitz news bloopers,0.32252848,weekly student news quiz cease fire sam altman cte,The Learning Network,
489,7302281580763024672,2023-11-16,mystery for your page reddit stories paranormal creepy,,0.39060545, podcasts about mysterious disappearances,Arts&Leisure,
490,7287242150184521006,2023-10-07,brooklyn brooklyn nine nine tv show tv series movie film tik tok for your page,,0.5002981,a brooklyn artist interrogates nypd surveillance films,Culture,
491,7244236483899706670,2023-06-13,duet with fairydee clothing the rookie bank robbery part season episode the rookie suspense tik tok made me watch it,,0.45106155,the idol season  episode  recap a human moment,Culture,
492,7281366550907489569,2023-09-21,crazy meme comedy dank memes funny uk uk memes snowboarding,snowboarder rescued tree well snowboarding what is a tree well skier saves snowboarder full video snowboarder gets rescued by stranger skiing rescue funny street snowboarding funny snowboarding,0.31780195,two pilots die in collision at national championship air races in reno,Foreign,
493,7302683595997760814,2023-11-18,what do i do league of legends,,0.33635983,do you like watching other people watch sports,Learning,
495,7284070719837785387,2023-09-28,funny family guy viral stewie griffin,,0.30046478,where the jimmy fallon story really started,OpEd,
496,7301935909618994475,2023-11-16,i know transformers all had us feeling a certain way megan fox transform transformers sam whit wiki movie op timo us prime,megan fox megan fox transformers prime megan fox megan fox now roxanne goofy movie megan fox natalie portman prime megan fox transformers jessica alba megan fox transformers,0.309967,megan rapinoe emma hayes and a womens soccer crossroads,Sports,
498,7302437873125510443,2023-11-17,the lobster fettuccine americaine from marks off madison in nycs flatiron district so good devour power food tik tok marks off madison nyc food nyc new york city lobster lobster pasta fettuccine seafood creamy nyc food ies nyc food blog new york city food pasta nyc pasta past any c,lobster bisque recipe seafood pasta pasta lobster lobster foodtiktok nyc food pasta food new york food new york city marks of madison,0.47675103,heres why a new york city lobster roll with fries costs ,Metro,
499,7296504283330055455,2023-11-01,stewie griffin being my favourite charactor in family guy part family guy peter,,0.3586049,is homer simpson a good dad now,Express,
500,7302661618981244168,2023-11-17,duet with leo landon doll,,0.32867023,at home with nina weinman,Real Estate,
501,7299862847977180447,2023-11-10,part for you film movie,chicago med drift king chicago med hank piano teacher tokyo drift dr choi hank and piano teacher dr choi and april chicago med april and ethan chicago med hank patient dr choi tokyo drift,0.24914205,jeffrey a bader who helped steer obamas pivot to asia dies at ,Obits,
502,7298468764075560225,2023-11-06,part story time reddit reddit stories,,0.4178606,two stories that unfold through letters,BookReview,
503,7285083581158886699,2023-10-01,this trend is too funny twice san as baby hairs what is love medieval bard core bard core k pop k pop,,0.2933723,kpop group celebrates wrong rangers at texas show,Express,
504,7302607700666502442,2023-11-17,colin jost and michael che swap jokes part snl weekend update comedy funny,,0.6512679,snl mocks george santos and welcomes a sassy panda,Culture,
505,7301819544828431646,2023-11-15,not giving up until i find a foot burmese python in the florida everglades fy p for you for you page wild florida florida life wildlife yo ink explore snake python gecko chameleon night usa alligators of tik tok animals reptile alligator cro cs crocodile everglades animals of tik tok swamp nature professional conservation,fishingarrett everglades burmese python chameleon cottonmouth snake crocodiles burmese python ft fishing garrett ft python chameleon change color snakes,0.43901548,quotation of the day shes less than charming to everglades pythons,Summary,
506,7302199562591030561,2023-11-16,mystery for your page reddit stories paranormal creepy,,0.39060545, podcasts about mysterious disappearances,Arts&Leisure,
507,7293169024882445599,2023-10-23,youre gonna want to get your hands on this polenta tortellini appetizer from da toscano nyc in nycs greenwich village sweet savory buttery cheesy all in one bite devour power food tik tok tor tell in i pole nt a honey da toscano new york city nyc food nyc italian food italian food appetizer new york city food nyc food blog nyc food ies parmigiano reggiano parmigiano olive oil greenwich village,polenta tortellini polenta da toscano nyc tortellini da toscano da toscano nyc food foodtiktok food nyc food on tiktok food new york,0.4123912,city island a little magical wonderland in the bronx,RealEstate,
509,7302098378656091425,2023-11-16,part story time reddit stories reddit,,0.4136337,two stories that unfold through letters,BookReview,
511,7302269611800612142,2023-11-16,yeaaah real valor ant funny trend it might seem crazy what im about to say gaming on tik tok gaming community gamer girl rel a table valor ant gaming banned for fun trending,,0.31169236,subway mania brings the cartoonish world of pro wrestling to commuters,Metropolitan,
512,7295013737189149995,2023-10-28,tik tok dragon game of th ones foy movie,mother of dragons daenerys dragons game of thrones dragons daenerys revenge daenerys targaryen game of the thrones daenerys daenerys qarth game of the thrones dragon game of thrones ending,0.30924898,buffy saintemaries indigenous parentage is questioned,Culture,
513,7297978623418518826,2023-11-05,todays cute cat tik tok para ti pour to i youtube cat,cute cat videos cute cat cat videos funny cat cat meowing ragdoll cat cat paws cute videos of cats cute cat tiktok videos cute cat clips,0.2867956,snl mocks george santos and welcomes a sassy panda,Culture,
514,7299524940125031686,2023-11-09,stuffed crust pepperoni pizza dip ingredients below serves people ingredients oz pizza dough ball pieces of setting cheese cut into pieces cup pepperoni slices cups pizza sauce oz room temperature cream cheese tbsp italian seasoning cup grated mozzarella egg cup garlic butter tbsp water cup grated parmesan,pizza dip food recipes pepperoni pizza pizza stuffed pizza crust pizza dough pizza recipe pizza crust homemade pizza cheese pizza recipe,0.3444631,ricotta pasta bake simple roasted salmon and coconutlime shrimp,Dining,
517,7293011314392223018,2023-10-23,every order includes a bonus milkshake license skin patrick spongebob stickers,arent you patrick star card skins card covers patrick star wallet credit cards skins patrick star license card patrick is this your wallet debit card covers spongebob driver license card skin covers,0.31470373,all the devils review patrick page as friendly guide investigating evil,Culture,
