,video_id,video_date,video_description,suggested_words,cos_score,headline,headline_type,headline_genre
741,7296605009469279530,2023-11-01,i tracked down one of the rarest opossums in the world opossum rare,opossum albino opossum albino raccoon pet opossum shiny opossum opossum vs possums opossum football field opossum videos animal hairless possum,0.51437837,the possum experiment,Podcasts,
742,7295976033054969131,2023-10-31,he la is he la hot,,0.36980915,is californias fire season over,National,
744,7292576830421339423,2023-10-21,her rel a table hot wheels chocolate syrup slideshow folded xyz abc,,0.29995668,mixing tequila and memories at donald judds dining room table,TStyle,
745,7297814276620750122,2023-11-04,is this funny to you mark zuckerberg i actually do cuss a little whatever who s gonna carry the boats hate life sm quit reading the tags im serious quit actually,,0.34195566,death disability its all fair game for the comic daniel sloss,Culture,
746,7299849887414455598,2023-11-10,if you had to choose are you devouring the bbq chicken juicy lucy sandwich or the juicy lucy burger from addys bbq edison nj devour power food tik tok addy s barbecue halal halal food juicy lucy cheese cheesy juicy lucy burger fried chicken long island long island new york long island ny chicken sandwich bbq bbq ny,devourpower chicken sandwich sandwiches halal food long island food burgers grilled chicken sandwich burger with cheese nj food spots cheese sandwich,0.3875785,classics for a reason crispy mustard chicken singapore noodles and ambrosia salad,Dining,
747,6970589524506266885,2021-06-06,like i would kiss that guy lol,,,classics for a reason crispy mustard chicken singapore noodles and ambrosia salad,Dining,
749,7290030076438023466,2023-10-15,hes still single ladies hinge date date night date crashers,,0.42492542,hed never date a lawyer or so he said,Styles,
751,7296715673084890398,2023-11-05,the sketch show sketch sketch comedy lee mack tim vine the sketch show humor funny comedy funny reels comedy reels comedy videos trending viral finance finance memes,,0.4594494,snl mocks george santos and welcomes a sassy panda,Culture,
753,7298408692230262049,2023-11-06,rosas scream when she sees her blonde hair brooklyn b rosa diaz,,0.36178994,maria callas was operas defining diva she still is,Arts&Leisure,
754,7296305836622761247,2023-10-31,wreck less wreck less driving on yo as s sucka,,0.3768427,the path to reducing pedestrian deaths is steep but straight,OpEd,
755,7276624814142426410,2023-09-09,whose line is it anyway,,0.3535075,whatever happened to local comedy scenes,Culture,
756,7298733975579807008,2023-11-07,the last one episode funny pet animals funny animals funny cats funny videos fun,,0.3779546,merry me review a loopy sex comedy focused on female pleasure,Culture,
757,7298862293528431873,2023-11-07,insta gram love reels status offical account,,0.28892875,threads will finally let users delete their accounts without losing instagram too,Express,
758,7288831945935457569,2023-10-11,whose line is it anyway,whose line is it anyway whose line is anyway liz gillies whose line is it anyway edits whose line is it anyway funny moments whose line is anyway buzzer mean in the show,0.37652713,whats on tv this week saturday night live and shining vale,Culture,
760,7297598419324144942,2023-11-04,real foot muc as foot muc a score,,0.26381958,measuring israel by the justwar yardstick,OpEd,
761,7281896391507447083,2023-09-23,cute pets episode funny pet cute,,0.30278817,meet a millionyearold koala you could cuddle like a cat,Express,
762,7282434373826415918,2023-09-24,when the cat realized the red is the good part lol fy pppppppp pppp p laugh hard for your page funny pet pets cats,,0.4148895,doja cats hit and  more ways of seeing red,Culture,
766,7298459286718500138,2023-11-06,we cannot get enough of the devourworthy dishes at elmstreetdiner in stamford ct if you had to choose which dish are you choosing first devour power food tik tok elm street diner stamford stamford ct stamford connecticut pasta pancakes pancake tacos brunch ct food ct food ies connecticut connecticut food ques a dill a burrito food ies food blog nyc food blog,elm street diner devourpower food tiktok pancakes foods of tiktok foodtok devour power elm street diner stamford ct restaurant ct restaurants connecticut food,0.34026778,heres why a new york city lobster roll with fries costs ,Metro,
768,7282892464866757893,2023-09-26,how to throw the mirage window smoke in cs cs cs go counter strike e sports valve,,0.25602448,an nfl stadium brings sports betting inside,Sports,
770,7276100236790091040,2023-09-07,mirage window smoke on cs cs cs beta cs na des counter strike cs update,,0.24380867,missile strike hits cherkasy ukraine,,
771,7279488344352951584,2023-09-16,high protein garlic butter steak bites crispy potatoes only calories truly one of the best combos so much flavor and absolutely takes no time to make macros per serving total calories g protein g carbs g fat ingredients servings g lean topside beef cut into cubes tsp salt tsp black pepper tsp garlic powder tsp parsley tsp olive oil g light butter for cooking g more to add at the end garlic cloves minced fresh chopped parsley crispy potatoes g uncooked potatoes season with salt pepper smoked paprika garlic parsley optional olive oil spicy mayo g light mayo g sriracha or any hot sauce lemon juice find more easy delicious recipes like this in my digital cookbook important cooking notes slice the beef into inch cubes to preven them from drying up when cooking and allowing to get a nice crust you can air fry the steak bites too for mins at c if you air fry the potatoes you dont need to add olive oil you can use store bought spicy mayo or make your own steak steak lover garlic butter steak bites beef beefsteak meal prep easy recipes healthy recipes high protein weight loss fat loss low calorie food ie potatoes healthy meals gym food,meal prep ideas butter steak bites recipe meal prep meal prep high protein steak bites healthy meals ideas air fryer recipes steak bites recipes crispy potatoes breakfast meal prep,0.3923326, easy dinner recipes for right now,Dining,
772,7291422833614261550,2023-10-18,found footage horror strange spooky conspiracy the lost tapes crypt ids aliens halloween,bam margera what happened to bam margera prank what happened to bam margera what happened to bam margera prank old man bam margera shi bag what happened to bam margera old man creepy real footage bam margera update scary video footage scaring people prank,0.3921995,were the fake trump signs a prank or a political dirty trick,Metropolitan,
775,7297425205100678442,2023-11-03,your telling me a shrimp de aaron fox is my goat dope shrimp,youre telling me a shrimp fried rice flaming shrimp dunking over sharks shrimp from shark tales shrimp fried rice cooking shrimp battered shrimp fried shrimp deaaron fox shrimp light bioluminescence shrimp,0.5686412,red lobsters popular endless shrimp deal ate into its profits,Express,
776,7296218781695741227,2023-10-31,i didnt know this was a universal experience inspo jade p,heavy whipping cream whipped cream smacking whipped cream heavy cream huffing whipped cream foods with heavy cream how to make whipped cream whips jade how to make whipped cream frosting,0.2743873,i decided i needed a slice of juniors strawberry cheesecake,Metropolitan,
779,7296958438494539051,2023-11-02,this is the single most hilarious thing ive ever read in my life tags meme funny rant burrito,,0.35905305,hold that thought heres why being interrupted is so irritating,Well,
780,7291708646394776864,2023-10-19,do you relate meme relationship memes boyfriend girlfriend cat,,0.28783098,if every brand is funny online is anything funny,Express,
784,7294748103284952353,2023-10-28,family guy family guy clips family guy funny moments stewie griffin brian griffin tv show clips funny clips family man clips s s family guy clips,girls with cup reaction family guy family guy clips two girls one grips cup family guy funny moments stewie griffin stewie family guy stewie from family guy stewie,0.2713896,snl returns with pete davidson and a taylor swift cameo,Culture,
785,7294467226583780650,2023-10-26,my first slideshow y shit posting slideshow tik tok slideshow dream industrial sabotage,,0.34754038, great songs from  the year not the album,Culture,
786,7283561723800505642,2023-09-27,sometimes you cant handle the truth da u key funny gaming escape the back rooms back rooms,,0.2909071,once again you lose me at the wall,OpEd,
787,7291353848633888043,2023-10-18,vlog of a day in my life without my patek compilation of my videos part,medazelli leave me alone short guy leave me alone leave me alone little guy tragic new patek shi tragic new patek leave me alone short guy phineas and ferb leave me alone please leave me alone that shits tragic new patek medazelliautomatic,0.26757392,still mourning takeoffs death quavo steps out alone,Culture,
790,7279241173573635359,2023-09-15,when you finally realize youre the problem husky life funny dogs siren howling howl dog comedy dogs video cute dog howling wolf viral dog husky humor dog humor chaos im the problem,,0.29260424,welcome to sweaty angry midlife heres your sullen teenager,BookReview,
791,7287863207081872683,2023-10-09,funny dogs comp dogs dogs of tik tok dog,,0.33222994,can my dog make me sick,Well,
792,7288448873410891041,2023-10-10,who s line is it anyway,,0.4151689,who is narges mohammadi,Foreign,
793,7293171148395646241,2023-10-23,meow im a kitty parody smash mouth all star cats of tik tok,disney disney disney card game tuxedo cat funny cat videos filters for cats funny animals videos cat meowing cat singing cattok,0.30231574,cat person review a viral short story padded for the big screen,Weekend,
794,7281102113348848938,2023-09-20,vine viral funny,,0.4448905,variety viral trigrams,Games,
795,7282235819824254254,2023-09-23,episode for you funny funny videos funny video animal animals animals of tik tok dogs of tik tok pet dog dogs,funny dog videos funny animal videos funny dog funny animal dog barking funny cats funny dog compilation cachorro se assustando dogs and cats dog videos,0.31219068,the animals are talking what does it mean,Magazine,
796,7295529028532849950,2023-10-29,im sorry ella fy p u gabriella,,0.27485237,julia louisdreyfus and nicole holofcener discuss you hurt my feelings,,
797,7295496772930080031,2023-10-29,found a kitty in the florida everglades fy p for you for you page everglades wild wildlife explore cat kitty wildlife photography yo ink snake python forest night alligator crocodile animals of tik tok,fishingarrett everglades burmese python cottonmouth snake crocodiles alligator feet burmese pythons snakes yoink wildlife animals,0.32795948,why a sculptor was drawn to sewer alligators,Metro,
798,7295959086716161322,2023-10-30,f naf meme explore page zy x cba walmart,,0.28685865,top ftx executive says sam bankmanfried used customer money for excess spending,Business,
799,7283664178143874347,2023-09-27,funny videos meme cats,,0.38294438,big cats big feelings,BookReview,
801,7284671563000139054,2023-09-30,his spidey sense mustve been tingling wife mom life mom wife life wives of tik tok husbands be like married life be like,,0.3251122,hollyanne milleys career presses on as her husbands wraps up,Washington,
802,7282082809211129120,2023-09-23,relationship girlfriend boyfriend memes meme,,0.37078273,all systems go after a relationship checkin,Styles,
803,7298101047707307295,2023-11-05,i offered this guy for all his games,,0.3221463,he cared about me so i broke up with him,Podcasts,
805,7284620668841332010,2023-09-30,cats of tik tok cute cat for your page tik tok,,0.3837903,doja cat goes horror pop and  more new songs,Culture,
806,7287977046746189062,2023-10-09,health hygiene products mental health hygiene esse sti als vibes hype room freak men,,0.29004237,how music can be mental health care,Well,
808,7298101670028922154,2023-11-05,trend for your page ts,,0.2703237,your new music mixtape,Podcasts,
810,7293031692753718574,2023-10-23,video funny so cute funny videos animals dog cat meme cute viral xu huon g,,0.3635725,frans hals and the art of laughter,Arts&Leisure,
812,7284627941017996590,2023-09-30,south park game four you page,south park poker face eric cartman poker face south park poker face cartman sings poker face california love south park cartman singing eric cartman cant read my poker face poker face lady gaga,0.2550813,popcast deluxe doja cats rap renaissance taylor swift travis kelce,Culture,
813,7287982091566877982,2023-10-09,we went all out at sammysfishbox on city island in the bronx nyc what a devourworthy experience we cant wait to go back where would you even start devour power food tik tok sammy s fish box seafood pa ella seafood pa ella city island bronx nyc nyc food new york city lobster lobster roll ribs surf and turf butter nyc food blog nyc food ies crab shrimp fried shrimp,sammys fishbox devourpower city island nyc sea food new york food nyc food new york lobster city island restaurants seafood restaurant fish,0.411423,city island a little magical wonderland in the bronx,RealEstate,
814,7297422720805915946,2023-11-03,you know that one hurt not gonna lie im a nerd and apparently no one watches studio ghibli halloween halloween look humor anime studio ghibli hurt my feelings,,0.47587454,whats it like to work with hayao miyazaki go behind the scenes,Culture,
816,7297468905482636577,2023-11-04,when the bobcat makes eye contact pub it y teresa dainesi via viralhog do not try this,bobcat lynx lynx cats pet bobcat babybobcat lynx vs bobcat bobcat scream why are bobcats dangerous bobcat attacks mainecoon cat,0.34020394,theres a moose on the loose in minnesota,Express,
817,7297261023529159969,2023-11-03,not the butt bump brooklyn b jake peralta,brooklyn jake peralta jake peralta brooklyn ninenine brooklyn ninenine brooklyn ninenine jake peralta and captain holt captain holt jake and amy brooklyn ninenine jake peralta edit brooklyn ninenine edits,0.3867662,heidi klum pauly shore and anya taylorjoy party in new york for halloween,Styles,
818,7296122145967541537,2023-10-31,dont cross lois this halloween youll regret it family guy candy trick or treat,,0.5621297,halloween is for kids kidults too,Business Day,
819,7297360993741475115,2023-11-03,bro,,0.48623532,my bad,Podcasts,
820,7297336150790884641,2023-11-03,relatable email for video creditremoval relationship relationship memes boyfriend girlfriend memes,,0.33546552,tiny love stories its a romcom opening baby,Styles,
821,7295802084572581166,2023-10-30,this surf turf burrito bowl from tacobees mexican grill in crown heights brooklyn nyc hits the spot and for just count us in devour power food tik tok taco bees burrito bowl burrito mexican food lunch lunchtime nyc mexican food nyc mexican restaurant taquer i a tacos burritos shrimp queso guacamole gua c nyc food blog nyc food ies new york city,chipotle bowl tacobees brooklyn burrito bowl burrito food nyc tacobees food new york food new york city restaurant nyc food in brooklyn nyc,0.33117485,noma cofounder opens a restaurant in brooklyn,Dining,
822,7280276556701011233,2023-09-18,imagine being bullied by a kg ball of fluff that struggles with indigestion,bunny bunny tantrum bunnies throwing tantrums bunny pet pet rabbit angry bunny bunny got possessed bunny punching bunnies throwing hands bunny stomping,0.30162016,to win big top tennis pros turn to marshmallows,Sports,
823,7286422129078275360,2023-10-05,this is why jake is the freakiest person at the brooklyn b jake peralta,,0.38415527,why it was worth  to become brooklyn org,Metro,
824,7286887149708807467,2023-10-06,brooklyn brooklyn nine nine tv show tv series movie film tik tok for your page,,0.5002981,a brooklyn artist interrogates nypd surveillance films,Culture,
826,7296533024424938782,2023-11-01,the thanksgiving side dish i look forward to all year around cheesy potato gratin,thanksgiving side dishes scalloped potatoes cheesy potato gratin thanksgiving recipes green bean casserole sliced potatoes recipe cheesy au gratin potatoes recipe potato au gratin thanksgiving food ideas thanksgiving appetizers,0.5155231,dinners that dont feel insane to cook the week of thanksgiving,Dining,
827,7295414052229123374,2023-10-29,so amazing infrastructure usa tik tok,infrastructure shanghai shimao construction in usa american infrastructure new buildings under construction in usa usa tunnel infrastructure underground cities places to visit usa american construction site,0.386689,country garden caves to debts as chinas real estate crisis worsens,Business,
828,7296475841884720426,2023-11-01,if you had to choose are you devouring the rigatoni carbonara or the cacio e pepe from roccos of roc beach pizza in queens nyc spoiler alert theyre both delicious devour power food tik tok food ies nyc food ies rocco s of roc beach rockaway beach pasta cac ioe pepe carbonara riga toni italian food italian cooking nyc italian nyc food blog new york city queens cooking recipe,,0.3789398,eatalys italian kingdom expands to soho,Dining,
832,7295080333953748267,2023-10-28,part funny cat videos funny cats funny animals funny pets,she was a fairy funny cat videos funny cats orange cat activities orange cat behavior orange cat funny animal videos cat videos cat swimming funny animal,0.2894319,if every brand is funny online is anything funny,Express,
833,7295805687181987114,2023-10-30,beef wellington dip gordon ramsay,gordon ramsay beef wellington gordon ramsay reacting to salt hank gordon ramsay react gordon ramsay beef wellington gordon ramsay reacting to beef wellington dip gordon ramsay salt hank salt hank food tiktok cooking videos,0.29928055,the south korean chefs redefining the art of pastry,,
834,7297993361892396330,2023-11-05,the smashrito double burrito from elmstreetdiner in stamford ct love this place devour power food tik tok burrito smash burger smash burger burrito cheeseburger stamford stamford ct connecticut ct food connecticut food brunch burger elm street diner food ies nyc food blog nyc food ies ct food ies ct food blog,elm street diner burritos food tiktok foodtok burger with cheese cheeseburger stamford ct restaurant food new york food new york city delicious food,0.37357983,hamburger america from a burger documentarian opens in the village,Dining,
835,7279171038745873696,2023-09-15,plz stream my song so i can afford to repair my house shit post meme genz rap tok indie,,0.32949573,soundtrack of a coup the revival of promilitary music in niger,Foreign,
836,7297653970087005470,2023-11-04,rest in peace bean chicago bean,the bean in chicago chicago bean the bean the bean in chicago being closed chicago bean bunny bean in chicago barrier bean whoville butter bean the bean cloud gate in chicago a baked bean,0.40637618,cracking the green bean casserole code,Dining,
837,7297262624062917921,2023-11-03,boyles never been humbled quicker in his life brooklyn b charles boyle,,0.4013512,charles t munger much more than warren buffetts no  dies at ,Obits,
838,7285775552349408558,2023-10-03,brooklyn brooklyn nine nine tv show tv series movie film tik tok for your page,,0.5002981,a brooklyn artist interrogates nypd surveillance films,Culture,
839,7288243955987139882,2023-10-10,flying squirrel pet feed cute flying pets cute animals honey kangaroo animal lover squirrel tok,,0.2497711,wildlife find human voices scarier than lion roars researchers say,,
840,7298061667080867102,2023-11-05,the bells sens this over the edge fy its always sunny in philadelphia mac rob m cel henn ey dennis reynolds glenn howe rton science is a liar sometimes science god evolution always sunny,its always sunny in philadelphia always sunny in philadelphia its always sunny in philadelphia israel dennis eating cereal dennis eating cereal in the car always sunny dennis reynolds dennis eating cereal always sunny always sunny evolution its always sunny in philadelphia evolution dennis cereal always sunny,0.30458194,chiseled cheekbones and comic chops why we dont like our standups hunky,Culture,
842,7288810536643415328,2023-10-11,the right way to rush b on mirage cs cs tips cs tips and tricks cs na des,,0.28541404,the best tips out of paris fashion week avoiding bedbugs,Styles,
843,7281711920363687211,2023-09-22,brooklyn brooklyn nine nine tv show tv series movie film tik tok for your page,melipnos jake and amy wedding melipnos b brooklyn wedding brooklyn jake and amy brooklyn marriage jake amy wedding brooklyn ninenine wedding dress brooklyn,0.40015286,roscioli nyc brings more of la dolce vita to manhattan,Dining,
844,7295822581783891246,2023-10-30,dogs of tik tok golden retriever r izz god medusa,,0.31372032,thelma golden wins gish prize,Culture,
845,7295143207875235078,2023-10-28,i got her wechat and we went to karaoke asian r izz asian boy asian dating man dar izz,double eyelids international students whats your wechat date with international student dating international student remy zee natural double eyelids international student rizz dating small face big eyes wechat,0.29685962,extreme eye contact and other ways of dating,Styles,
846,7295596672615238955,2023-10-30,i knew nate bargatze wouldnt disappoint in saturday night live snl nate bar g atze nate bar g atze comedy nate bar g atze helloworld nate bar gat zest and up snl nate bar g atze nate bar g atze snl snl saturday night live snl sketch snl skit saturday night live edit saturday night lives kit saturday night live cast saturday night live clip,nate bargatze snl snl nate bargatze nate bargatze snl cooking skit nate bargatze wife saturday night live snl nate bargatze comedy nate bargatze airport nate bargatze snl george washington nate bargatze snl skits,0.46096957,snl returns with pete davidson and a taylor swift cameo,Culture,
847,7296332950193360158,2023-10-31,fish sea laughing funny xy bc za viral,,0.29449636,an extremely photogenic sheetpan chicken,Dining,
848,7296209313746537774,2023-10-31,going all out at realdonerhaus in nycs east village is one of our favorite pastimes seriously this place rules still trying to think of where we know that logo from which döner kebab or döner box are you devouring first devour power food tik tok doner d ner german doner doner kebab german food german kebab doner meat beef doner chicken doner white sauce nyc food ies nyc food blog new york city new york city food fries,,0.33290255,roti a shapeshifting global staple takes a new form convenience food,Dining,
849,7292431731284593953,2023-10-21,itachi must of felt true pain in that moment naruto naruto ship pu den itachi itachi uchiha sasuke sasuke uchiha fag uk a fag uk a uchiha a ot attack on titan e ren e ren yeager viral viral video anime anime tik tok anime fy p fy pppppppp pppppppp pppp ppp,,0.27867213,writers guild faces backlash for not condemning hamas attack,Business,
851,7297334528081726750,2023-11-03,poor cat cats of tik tok cat depressing cat viral,,0.26580942,a youtube gossip spills a secret of her own,Styles,
852,7295762453927857454,2023-10-30,we went all out with thai food at durian new rochelle in new rochelle new york and loved every second of it which dish are you devouring first that braised lamb shank and sweet roti were both incredible devour power food tik tok thai food thai dishes thai durian pad thai pad see ew rice noodles curry shrimp lambs hank braised lamb nyc food ies nyc food blog new york food dessert roti thai food new york,,0.41969717,restaurant review hakka food makes a rare appearance in chinatown,Dining,
853,7288065300560399658,2023-10-10,watching the isreal palestine war online comedy comedian humor stand up stand up comedy stand up comedian shane gillis ms sp,shane gillis shane gillis trump shane gillis george washington shane gillis comedy shane gillis uncle danny shane gillis navy seals shane gillis australian accent shane gillis funniest moments shane gillis standup uncle danny grilled cheese shane gillis,0.29724446,aaron spears drummer for usher and other stars dies at ,Express,
854,7296823169543834923,2023-11-02,nah,soft launch samantha soft launch what is soft launch soft launching meaning theartofkat hard launch what does soft launch mean jacob hoff and samantha ricochet and samantha jalen and monet soft launch,0.39840037,spacex makes progress in nd launch of giant moon and mars rocket,Science,
856,7297846970633194798,2023-11-05,tom and jerry cartoon animation decompression cure childhood a animation fun funny videos funny tik tok carr to on tom j err cart ton,,0.31920016,snl mocks george santos and welcomes a sassy panda,Culture,
858,7297039681865272618,2023-11-02,forest green thoughts forest green relationship my favorite person green thoughts favorite smile,,0.3001944,quotation of the day as rangers indonesian women guard the forest they live in,Summary,
859,7288391457247939872,2023-10-10,which would you get rid of picky eater food food ie vegan food this or that food this or that food edition swipe game swipe trend choose one swipe games trending swipe challenge this or that game this or that challenge this or that,,0.3189327,shoes on the table and other challenges to the fashion status quo,Styles,
860,7297262615590358304,2023-11-03,this has to be one of jakes most evil pranks brooklyn b jake peralta,,0.33440173,tyler christopher actor best known for general hospital dies at ,Obits,
861,7289248944687779115,2023-10-12,funny slideshow funny laugh meme memes slideshow,party rock anthem james and the giant peach who sings party rock anthem lazy meal funny tweets slideshow go to lazy meal funny video funny videos laugh funny tiktok videos funny moments,0.3873033,what is the scariest song of all time poem youtube video,Podcasts,
